{
  "$schema": "./form-schema.schema.json",
  "format": 2,
  "version": "1.0",
  "parts": {
    "address": {
      "component": "$component(Box)",
      "componentProps": {
        "className": "space-y-4"
      },
      "children": [
        {
          "component": "$component(Box)",
          "componentProps": {
            "className": "grid grid-cols-2 gap-4"
          },
          "children": [
            {
              "model": "$model(region)",
              "component": "$component(Input)",
              "componentProps": {
                "label": "Регион",
                "placeholder": "Введите регион"
              }
            },
            {
              "model": "$model(city)",
              "component": "$component(Input)",
              "componentProps": {
                "label": "Город",
                "placeholder": "Введите город"
              }
            }
          ]
        },
        {
          "model": "$model(street)",
          "component": "$component(Input)",
          "componentProps": {
            "label": "Улица",
            "placeholder": "Введите улицу"
          }
        },
        {
          "component": "$component(Box)",
          "componentProps": {
            "className": "grid grid-cols-3 gap-4"
          },
          "children": [
            {
              "model": "$model(house)",
              "component": "$component(Input)",
              "componentProps": {
                "label": "Дом",
                "placeholder": "№"
              }
            },
            {
              "model": "$model(apartment)",
              "component": "$component(Input)",
              "componentProps": {
                "label": "Квартира",
                "placeholder": "№"
              }
            },
            {
              "model": "$model(postalCode)",
              "component": "$component(InputMask)",
              "componentProps": {
                "label": "Индекс",
                "placeholder": "000000",
                "mask": "999999"
              }
            }
          ]
        }
      ]
    },
    "property": {
      "component": "$component(Box)",
      "componentProps": {
        "className": "space-y-3"
      },
      "children": [
        {
          "model": "$model(type)",
          "component": "$component(Select)",
          "componentProps": {
            "label": "Тип имущества",
            "placeholder": "Выберите тип",
            "options": [
              {
                "value": "apartment",
                "label": "Квартира"
              },
              {
                "value": "house",
                "label": "Дом"
              },
              {
                "value": "land",
                "label": "Земельный участок"
              },
              {
                "value": "commercial",
                "label": "Коммерческая недвижимость"
              },
              {
                "value": "car",
                "label": "Автомобиль"
              },
              {
                "value": "other",
                "label": "Другое"
              }
            ],
            "testId": "property-type"
          }
        },
        {
          "model": "$model(description)",
          "component": "$component(Textarea)",
          "componentProps": {
            "label": "Описание",
            "placeholder": "Опишите имущество",
            "rows": 2,
            "testId": "property-description"
          }
        },
        {
          "model": "$model(estimatedValue)",
          "component": "$component(InputNumber)",
          "componentProps": {
            "label": "Оценочная стоимость",
            "placeholder": "0",
            "min": 0,
            "step": 1000,
            "testId": "property-estimatedValue"
          }
        },
        {
          "model": "$model(hasEncumbrance)",
          "component": "$component(Checkbox)",
          "componentProps": {
            "label": "Имеется обременение (залог)",
            "testId": "property-hasEncumbrance"
          }
        }
      ]
    },
    "existingLoan": {
      "component": "$component(Box)",
      "componentProps": {
        "className": "space-y-3"
      },
      "children": [
        {
          "model": "$model(bank)",
          "component": "$component(Input)",
          "componentProps": {
            "label": "Банк",
            "placeholder": "Название банка",
            "testId": "existingLoan-bank"
          }
        },
        {
          "model": "$model(type)",
          "component": "$component(Select)",
          "componentProps": {
            "label": "Тип кредита",
            "placeholder": "Выберите тип",
            "options": "$dataSource(EXISTING_LOAN_TYPES)",
            "testId": "existingLoan-type"
          }
        },
        {
          "component": "$component(Box)",
          "componentProps": {
            "className": "grid grid-cols-2 gap-4"
          },
          "children": [
            {
              "model": "$model(amount)",
              "component": "$component(InputNumber)",
              "componentProps": {
                "label": "Сумма кредита (₽)",
                "placeholder": "0",
                "min": 0,
                "step": 1000,
                "testId": "existingLoan-amount"
              }
            },
            {
              "model": "$model(remainingAmount)",
              "component": "$component(InputNumber)",
              "componentProps": {
                "label": "Остаток долга (₽)",
                "placeholder": "0",
                "min": 0,
                "step": 1000,
                "testId": "existingLoan-remainingAmount"
              }
            }
          ]
        },
        {
          "component": "$component(Box)",
          "componentProps": {
            "className": "grid grid-cols-2 gap-4"
          },
          "children": [
            {
              "model": "$model(monthlyPayment)",
              "component": "$component(InputNumber)",
              "componentProps": {
                "label": "Ежемесячный платеж (₽)",
                "placeholder": "0",
                "min": 0,
                "step": 100,
                "testId": "existingLoan-monthlyPayment"
              }
            },
            {
              "model": "$model(maturityDate)",
              "component": "$component(Input)",
              "componentProps": {
                "label": "Дата погашения",
                "type": "date",
                "testId": "existingLoan-maturityDate"
              }
            }
          ]
        }
      ]
    },
    "coBorrower": {
      "component": "$component(Box)",
      "componentProps": {
        "className": "space-y-3"
      },
      "children": [
        {
          "component": "$component(Box)",
          "componentProps": {
            "className": "grid grid-cols-3 gap-4"
          },
          "children": [
            {
              "model": "$model(personalData.lastName)",
              "component": "$component(Input)",
              "componentProps": {
                "label": "Фамилия",
                "placeholder": "Введите фамилию",
                "testId": "coBorrower-lastName"
              }
            },
            {
              "model": "$model(personalData.firstName)",
              "component": "$component(Input)",
              "componentProps": {
                "label": "Имя",
                "placeholder": "Введите имя",
                "testId": "coBorrower-firstName"
              }
            },
            {
              "model": "$model(personalData.middleName)",
              "component": "$component(Input)",
              "componentProps": {
                "label": "Отчество",
                "placeholder": "Введите отчество",
                "testId": "coBorrower-middleName"
              }
            }
          ]
        },
        {
          "model": "$model(personalData.birthDate)",
          "component": "$component(Input)",
          "componentProps": {
            "label": "Дата рождения",
            "type": "date",
            "testId": "coBorrower-birthDate"
          }
        },
        {
          "component": "$component(Box)",
          "componentProps": {
            "className": "grid grid-cols-2 gap-4"
          },
          "children": [
            {
              "model": "$model(phone)",
              "component": "$component(InputMask)",
              "componentProps": {
                "label": "Телефон",
                "placeholder": "+7 (___) ___-__-__",
                "mask": "+7 (999) 999-99-99",
                "testId": "coBorrower-phone"
              }
            },
            {
              "model": "$model(email)",
              "component": "$component(Input)",
              "componentProps": {
                "label": "Email",
                "placeholder": "example@mail.com",
                "type": "email",
                "testId": "coBorrower-email"
              }
            }
          ]
        },
        {
          "component": "$component(Box)",
          "componentProps": {
            "className": "grid grid-cols-2 gap-4"
          },
          "children": [
            {
              "model": "$model(relationship)",
              "component": "$component(Select)",
              "componentProps": {
                "label": "Отношение к заемщику",
                "placeholder": "Выберите отношение",
                "options": "$dataSource(RELATIONSHIPS)",
                "testId": "coBorrower-relationship"
              }
            },
            {
              "model": "$model(monthlyIncome)",
              "component": "$component(InputNumber)",
              "componentProps": {
                "label": "Ежемесячный доход (₽)",
                "placeholder": "0",
                "min": 0,
                "step": 1000,
                "testId": "coBorrower-monthlyIncome"
              }